110,"유난히 판단과 사고가 명석해 지는 기간이니 마음이 움직이는 대로 표현하고 행동하라. 학업, 연구, 업무등의 실적 향상을 위해 투자한다면 기대 이상의 성과를 얻을 것이다.",중요하지 않은 일에 노력을 허비하지 말라. 하고자 하는 일과 해야 하는 일 사이에서 다소 혼선과 갈등이 생길 수 있으니 신중히 판단하고 행동하라.,한발 물러서 상황을 바라보는 마음의 여유가 필요하다. 조급하게 서두르지 않고 신중함을 가진다면 안 될것 또한 없다. 한박짜 쉬어간다고 생각하라.,특별히 좋을 것도 그렇다고 나쁠 것도 없다. 별다른 어려움 없이 진행 할 수 있으니 땀 흘린 만큼의 성과는 기대해도 좋다. 성실한 노력만이 필요할 뿐이다.,자신의 능력을 믿고 강하게 추진하던 일들이 막힘이 있다. 주위에 도움을 줄 많은 지인분들이 있으니 주저하지 말고 부탁하라. 흔쾌히 승락하여 어려움을 해결해 줄 것이다.,주위에서 나를 찾는 시기이다. 무엇을 부탁받는 자리가 아니라면 조금 귀찮다 느끼더라도 즐겁게 맞이 해는 것이 좋다. 원만한 대인관계가 많은 일들을 해결하는 지름길 임을 잊지 말라.,야망이 클 수록 위험도 커진다. 감당 할 수 없는 일을 벌이기 보다는 자신이 할 수 있는 만큼만 일을 벌이고 처리하는 것이 가장 현명한 태도이다.,"나서지 말고 침착하게 자신의 역할 자신의 몫을 챙기는 것이 좋다. 업무에 관련된 사항은 빨리 처리하는 게 좋으며, 당신의 탁월한 재능으로 남들이 어렵다고 한 일도 쉽게 처리할 수 있을 것이다.","일의 진행이 빨라지는 시기이니, 자신이 가지고 있는 능력을 십분 발휘하면 원하는 걸 얻을 수 있다. 다른 사람들과 충돌하기 보다 화해의 길을 모색하는 게 유리하며, 새롭게 시작하는 일에 앞서 기존의 일들은 마무리를 해야한다.",장기적인 안목으로 차분히 준비하라. 지금 당장 눈 앞에 보이는 것이 전부는 아니다. 큰 그림을 그려 큰 것을 얻으려 생각하고 고민할 때이다.,주위의 여건들이 많이 좋아 졌다는 것을 느낄수 있다. 이런 상황이라면 좋은 결과를 기대해봐도 좋은 것이다. 긍정적인 생각으로 착실히 진행하기 바란다.,중요하지 않은 일에 노력을 허비하지 말라. 하고자 하는 일과 해야 하는 일 사이에서 다소 혼선과 갈등이 생길 수 있으니 신중히 판단하고 행동하라.
111,기회는 항상 주변에 있는 법. 무엇을 선택하는 가에 따라 결과는 달라진다. 진심어린 주위의 조언을 허투로 듣지 말고 현명한 선택을 원한다면 귀 기울여야 할 것이다.,"많은 어려움을 느끼게 된다. 뜻하지 않은 곳에서 도움의 손길이 도착하게 되니, 그 간의 노력들이 헛되지 않음을 느끼게 될 것이며, 더욱 더 관계 개선에 힘써야 할 것이다.",눈 앞에 닥친 위기는 모면할 수 있으나 더 큰 파도가 몰려오고 있으니 아직은 안심하고 기뻐할 때가 아니다. 지금 이상으로 노력으로 대처해야 할 것이다.,선택에는 항상 고민이 따르는 법. 지금의 작은 것을 얻는다면 후에 올 큰 것을 얻지 못할 것이다. 지금 당장의 이익 보다는 대인관계에 집중하는 것이 좋을 것이다.,능력의 한계를 느끼거나 부담스러운 일을 맡게 되더라고 몸으로 부딫치고 발로 뛰어 자신의 능력의 한계를 높인다면 큰 결실을 얻게 될 것이다.,몸은 고되지만 결과에 만족함을 느낀다. 보상도 보상이지만 큰 일을 해냈다는 생각에 자신감이 충만하게 될 것이다. 무엇이든 할수 있을 것 같은 자신감이야 말로 최고의 보상일 것이다.,겉모습이 그 사람의 전부가 아니다. 선입견 또는 겉모습으로 평가하기 보다는 진실된 마음을 보아야 한다. 귀인으로 다가올 사람을 겉모습으로 판단하는 오류를 범하지 않기 바란다.,자신의 탁월한 능력이 주위의 시샘하거나 질투로 돌아 올 수 있으니 행동에 더욱 신중함이 필요하다. 괜한 부스럼 거리는 만들지 않는 것이 좋다.,대수롭지 않게 생각했던 일들이 큰 어려움으로 되돌아 온다. 중요한 일이니 만큼 한번더 생각하고 작은것 하나도 놓치는 일이 없도록 매사에 꼼꼼하게 챙기고 신중에 신중을 기해야 한다.,대인관계가 매우 좋다. 불편했던 관계의 지인들과 대면대면 했다면 이번을 기회로 삼아 화해를 하는 것도 좋을 것다. 먼저 손을 내밀면 응할 것이며 충분히 개선의 여지가 있다.,자신의 의견을 많이 제시하기 보다는 많이 경청하는 것지 좋다. 삶의 지혜가 되는 이야기들을 많이 들을 수 있으며 누군가를 도와줄수 있는 아이디어를 많이 얻게 될 것이다.,인맥관리 역시 굉장히 중요한 투자임을 잊지마라. 소홀함이 있었는지 한번 되돌아 보고 부족함을 반성하는 자리를 마련하여 보다 돈독한 관계 유지에 힘써라.
112,시작이 좋다고 하나 마무리가 좋지 않으면 결과 또한 좋지 않을 수 있다. 끝까지 최선을 다하는 모습이야 말로 좋은 결과를 얻는 가장 현명한 방법일 것이다.,어려운 문제가 발생한다. 지금의 문제가 무엇이며 해결 방법은 무엇인지 슬기로운 상황대처 능력이 필요하다. 필요하다면 주위의 도움을 받는 것도 하나의 방법일 것이다.,혼자 하는 일에는 한계가 있다. 모두 내것인양 가지고 있어봐야 몸은 몸대로 힘들어 지고 고민만 늘어난다. 협업 또는 도움을 요청해 원만하게 해결하는 것이 가장 현명하다.,어려움이 없는 나날들이 얼마나 되겠는가. 지금의 시간이 지나면 좋은 결과가 만들어 진다. 좋은 기운이 생기고 있으니 좋게 좋게 생각하라. 좋은 결과가 있을 것이다.,이일 저일 모두 관여하게 되어 평소보다 힘들어 지겠다. 자신의 일의 성과가 저조하다고 실망할 필요는 없다. 이런날도 있고 저런날도 있는 것이다. 언젠가 도움 받을 날이 오지 않겠는가.,큰 성공을 위해 지금의 고생은 당연하다. 새로운 일이 시작고 손이 바쁘지만 모두가 미래를 위해 기반을 다지는 작업이니 바쁘더라도 소홀해서는 안된다.,노력한 만큼의 결과는 충분히 보상받는다. 결과에 만족하고 더 이상의 욕심은 없어야 한다. 기분 좋게 지인이나 가족과 시간을 보내는 것이 좋겠다.,실수는 있겠지만 걱정할 필요까지는 없다. 동료나 직장상사로 부터의 도움으로 원만히 해결 가능하다. 기죽지 말고 용기백배해서 하던 일에 최선을 다하면 된다.,새로운 아이디어가 생기고 의욕도 충만해지고 정신도 맑아 무슨 일이든 해결 가능 한듯 하다. 순간 판단력도 좋아지니 추친하는 일에 막힘이 없겠다. 다만 무모한 자신감은 금물이다.,분수에 넘치면 손해 본다. 자기 꾀에 자기가 넘어가는 실수를 하지 말라. 너무 큰 일을 바라지 말고 자기 능력에 맞춰 본분을 지킨다면 무난할 것이다.,하늘의 도움을 받았다 할 만하다. 막힘 없이 진행되는 모든 것들이 그저 신기할 뿐이다. 새로운 일을 시작해도 좋고 뜻했던 일들을 과감히 진행해도 좋다.,같은 실수를 반복하는 것은 좋지 않다. 주위의 의견을 수렴하여 적용한다면 아무 문제 없을 것이다. 그렇다고 할 일을 미루는 것은 좋은 선택이 아니다. 관리에 신경쓰라.
113,자신의 당신의 능력 만으로도 충분히 성과를 얻어 낼 수 있으며 주위를 감동시킬 수 있다. 하지만 자신감이 부족한것이 안타깝기만 하다. 망설임 없이 적극적인 자세가 필요하다.,마주하고 싶지 않다 하여 피할 수는 없다. 의지만 있다면 아무일 아닌것 처럼 행동 할 수 있습니다. 이정도의 노력 없이 결과를 얻을 수는 없다. 침착하게 평상시대로 생각하고 행동하라.,"바쁘다는 핑계로  소홀했던 지인, 친구들과의 자리를 마련해 보라. 세상은 혼자 사는 것이 아니기에 돈독한 관계가 후에 크게 도움이 될것이다.",나의 성실함이 주위의 활력소가 될 것이다. 이니 많은 사람들이 나를 좋아하게 되는 것이니 더 많은 사람들과의 대인관계를 위해 노력해야 할 시기이다. 좋은 선순환 관계가 될 것이다.,지금이 가장 행복한 시간일 것이다. 더 이상의 욕심은 무리일듯 싶다. 더이상 진전이 없는 현상 유지만 한다 해도 아주 충분히 여유롭게 생활 할 수 있다. 현재의 즐거움을 만끽하라.,강력한 카리스마를 바탕으로 추진한 일들이 성공적으로 마무리가 되어 큰 성취감을 느낄 것이다. 지금의 기분이라면 어떤 고난과 어려움이 닥쳐도 흔들림 없이 해쳐나갈 것 같은 마음이다.,서두르지 마라. 급하게 결정할수록 실수만 생긴다. 무엇보다 신중함이 필요하다. 곰곰히 생각해보고 반드시 필요한 것만 실행하면 된다.,계획이 작다고 성과가 작고 초라하다 볼 수는 없다. 모든 일에는 시작이 중요한 법이다. 하고 싶은 일이 있다면 작은것 하나를 먼저 시작하는 자세가 필요하다.,사소한 일에 괜한 고집을 부릴 필요가 없다. 이치에 맞는 행동을 하면 되는 것이다. 이성적이지 못한 엉뚱한 판단을 하게 된다면 주위의 화를 자초하게 되는 꼴이다. 너그러운 마음을 가져라.,지출은 꼼꼼하게 체크하고 계획되지 않은 것은 자제하라. 즉흥적인 결정은 후회 할 일을 만들 뿐이다. 평소대로 하면 무난하다.,허리띠를 졸라매도 지출이 많은 시기이니 투자나 큰 지출을 계획하고 있다면 다음으로 미루는 것이 좋다. 섣부른 판단으로 괜한 일을 벌리지 않는 것이 좋다.,가는 것이 있다면 오는 것이 있는법. 지금 잃어버린 것들은 더 좋은 기회로 다시 찾아올 것이다. 낙심하고 있을 시간에 더욱 노력하라.
114,노력한 만큼의 보상은 주어 질 것이니 마음을 편히 하라. 사실 복잡하게 생각할 것도 없다. 묵묵히 자신의 일에 최선을 다하기만 하면 된다.,"노력에 대비 큰 결과를 얻게 된다. 기분이 절로 좋아질 것이다. 조금 나누면 더 좋을 것이다. 어떤 것이 되든, 자신의 일에 조금은 욕심을 낼만 하다. 좋은 기회이니 십분 활용하라.",지금의 실수는 최선을 다하지 않았기에 발생한 것이다. 어쩌면 잘 된 일일지도 모른다. 마음을 추스릴 수 있는 기회로 삼는다면 미래를 위해서도 더 좋을 것이다. 실망하지 말라.,어리석은 행동으로 반복되는 실수는 없어야 한다. 생색내기 보다는 실속를 찾는 방법을 찾아야 한다. 괜시레 남 좋은 일을 할 필요는 없지 않은가.,"한 순간의 실수가 엄청난 결과를 불러 올 수 있다. 사소한 것도 신중하게 생각하고 판단해야 하며, 특히 지출이 필요하다면 꼭 다시 한번 생각해보라.",어렵게 이룬 것이지만 때로는 과감하게 쓸줄도 알아야 한다. 모으는 재미도 솔솔하지만 못지않게 잘 사용하는 법도 중요하다. 주위에 부족한 사람이 없는지 한번더 챙겨보라. 결국은 자신을 위해 사용하는 것이 될것이다.,정해진 것이 하나도 없다. 모두가 스스로 결정하고 정해야 하는 일들 뿐이다. 꼼수를 부리지 말고 서두를것 없이 신중하게 생각하고 순리에 맞게 진행하라.,나와 생각이 다름을 이해하고 너그러운 마음의 자세가 필요하다. 생각을 다르게 하면 별일 아닐 수 있으나 막상 받아들이기는 쉽지 않겠지만 대인 관계를 넗히는 하나의 방법이라 생각하자.,대화가 필요한 시기이다. 크다면 크고 작다면 작은 일이지만 여럿이 같이 하는 일이기에 혼자 고민한다고 해결되지는 않는다. 먼저 말을 건네 해결 방법을 찾아라. 금방 해결 할 수 있다.,사소한 시비거리가 생길 수 있다. 그동안 쌓였던 감정들을 정리할 수 있는 기회가 된다. 묵힌다고 다 좋은건 아니니 이번 기회에 털어버리고 좋은 관계를 만들가. 전화위복이 된 결과다.,혼자만의 생각을 고집하게 된다면 독단과 독선에 빠질수 있으니 주위의 의견을 귀담아 들어 자신의 것으로 만들어야 한다. 보다 많은 대화를 나눌 수 있는 시간을 할애하라.,힘들다고 느낄 것이다. 어렵고 힘들지 않게 결과를 얻을 수는 없다. 이 또한 지나가는 과정이라 생각하고 낙심하지 말고 느긋한 마음을 가져라. 마음이 편해서 성과가 있다.
115,지나친 욕심은 일을 그르치지 쉽다. 노력한 만큼의 결과는 있을 것이다. 차분한 마음으로 진행하는 일에 최선을 다하는 것이 가장 현명한 일이다.,시작이 좋다고 하나 마무리가 좋지 않으면 결과 또한 좋지 않을 수 있다. 끝까지 최선을 다하는 모습이야 말로 좋은 결과를 얻는 가장 현명한 방법일 것이다.,어려운 문제가 발생한다. 지금의 문제가 무엇이며 해결 방법은 무엇인지 슬기로운 상황대처 능력이 필요하다. 필요하다면 주위의 도움을 받는 것도 하나의 방법일 것이다.,혼자 하는 일에는 한계가 있다. 모두 내것인양 가지고 있어봐야 몸은 몸대로 힘들어 지고 고민만 늘어난다. 협업 또는 도움을 요청해 원만하게 해결하는 것이 가장 현명하다.,어려움이 없는 나날들이 얼마나 되겠는가. 지금의 시간이 지나면 좋은 결과가 만들어 진다. 좋은 기운이 생기고 있으니 좋게 좋게 생각하라. 좋은 결과가 있을 것이다.,이일 저일 모두 관여하게 되어 평소보다 힘들어 지겠다. 자신의 일의 성과가 저조하다고 실망할 필요는 없다. 이런날도 있고 저런날도 있는 것이다. 언젠가 도움 받을 날이 오지 않겠는가.,큰 성공을 위해 지금의 고생은 당연하다. 새로운 일이 시작고 손이 바쁘지만 모두가 미래를 위해 기반을 다지는 작업이니 바쁘더라도 소홀해서는 안된다.,노력한 만큼의 결과는 충분히 보상받는다. 결과에 만족하고 더 이상의 욕심은 없어야 한다. 기분 좋게 지인이나 가족과 시간을 보내는 것이 좋겠다.,실수는 있겠지만 걱정할 필요까지는 없다. 동료나 직장상사로 부터의 도움으로 원만히 해결 가능하다. 기죽지 말고 용기백배해서 하던 일에 최선을 다하면 된다.,새로운 아이디어가 생기고 의욕도 충만해지고 정신도 맑아 무슨 일이든 해결 가능 한듯 하다. 순간 판단력도 좋아지니 추친하는 일에 막힘이 없겠다. 다만 무모한 자신감은 금물이다.,분수에 넘치면 손해 본다. 자기 꾀에 자기가 넘어가는 실수를 하지 말라. 너무 큰 일을 바라지 말고 자기 능력에 맞춰 본분을 지킨다면 무난할 것이다.,하늘의 도움을 받았다 할 만하다. 막힘 없이 진행되는 모든 것들이 그저 신기할 뿐이다. 새로운 일을 시작해도 좋고 뜻했던 일들을 과감히 진행해도 좋다.
116,행운이란 언제나 예기치 못한 뜻밖의 상황에서 찾아온다. 너무 큰 욕심이 아니라면 한번 기대해도 좋을 것이다. 긍정을 긍정을 부르는 것이다.,말과 행동에 보다 세심한 주의가 필요하다. 스스로가 모든 문제를 해결할 수 있는 열쇠임을 인지하고 숙고하고 판단하고 행동해야 할 것이다. 자신의 말과 행동이 성패를 가른다는 사실을 잊지 말라.,"눈 앞의 이익에 현혹되지 말라. 반듯이 후회하게 된다. 무엇을 결정해야 한다면 더욱 신중하게 세심한 주의가 필요할 것이며, 미래를 보는 안목이 필요하다.",순조롭다. 좋은 결과가 기대된다. 넘치는 의욕과 실력이 허락하는 만큼 힘 닿는 대로 추진하라. 한번쯤 욕심을 부려 볼 만한 시기이니 잘 활용하여 성과를 이루라.,시작도 좋고 진행 과정도 좋다. 안락함을 기대할 수 있지만 지나친 방심은 금물이다. 한눈 팔지 말고 집중해서 마무리까지 챙겨야 한다. 조금만 더 신중하라.,저절로 이루어 지는 것이 있다면 얼마나 좋을까. 누가 해주기를 기다리기 보다는 직접 나서서 움직이고 행동하라. 노력한 만큼의 결과는 얻게 될 것이다.,"마음은 심란하고 갈등이 많아진다. 주위의 솔깃한 이야기들이 많아 마음을 잡기가 더더욱 어렵겠지만, 자신의 생각이 옳다고 판단하고 소신것 행동하라.",뜻하지 않는 반전으로 상황이 어려워 진다. 이럴때 일수록 더욱 마음을 추스르고 행동 하나하나 분명히 해야 할 것이다. 무엇보다 마음이 흔들리지 않게 확실히 다 잡아야 할 것이다.,모든 일에는 시련이 있기 마련이다. 인내는 쓰고 열매는 달다는 것을 상기하며 지금의 고비를 잘 극복해야 할것이다. 끝까지 최선을 다해 지금의 어려움을 극복하라.,주위 여건이 좋지 않은 상황에서 일이 추진된다. 그러나 좌절할 필요는 없다. 꿋꿋이 밀고 나가야 한다. 끈기 있는 도전이 머지않아 결실을 맺게 될 것이다.,얻기만 할 수는 없는법. 얻는 것이 있다면 잃는 것도 있다. 작은 것을 잃고 큰 것을 얻기 위해 현명판 판단을 할 수 있도록 해야 한다. 또한 비록 조금 더 잃는 다고 낙심 할 것 까지는 아니니 개념치 말라.,서둘러 진행한다고 모든 것이 빨리 해결되는 것은 아니다.  새로운 것을 시작하기에 앞서 충분한 조율의 시간을 갖어라. 자신이 생각하는 것보다 조금만 낮춘다면 잘 해결될 것이다.
117,도와주려는 마음은 좋지만 상대가 조언을 받아들일 준비가 안된듯 하다. 기분 상하지 않도록 조근조근 설명해야 할 것이다. 묵묵히 자기 일만 진행하는 것도 나쁘지 않다.,노력한 만큼의 보상은 주어 질 것이니 마음을 편히 하라. 사실 복잡하게 생각할 것도 없다. 묵묵히 자신의 일에 최선을 다하기만 하면 된다.,"노력에 대비 큰 결과를 얻게 된다. 기분이 절로 좋아질 것이다. 조금 나누면 더 좋을 것이다. 어떤 것이 되든, 자신의 일에 조금은 욕심을 낼만 하다. 좋은 기회이니 십분 활용하라.",지금의 실수는 최선을 다하지 않았기에 발생한 것이다. 어쩌면 잘 된 일일지도 모른다. 마음을 추스릴 수 있는 기회로 삼는다면 미래를 위해서도 더 좋을 것이다. 실망하지 말라.,어리석은 행동으로 반복되는 실수는 없어야 한다. 생색내기 보다는 실속를 찾는 방법을 찾아야 한다. 괜시레 남 좋은 일을 할 필요는 없지 않은가.,"한 순간의 실수가 엄청난 결과를 불러 올 수 있다. 사소한 것도 신중하게 생각하고 판단해야 하며, 특히 지출이 필요하다면 꼭 다시 한번 생각해보라.",어렵게 이룬 것이지만 때로는 과감하게 쓸줄도 알아야 한다. 모으는 재미도 솔솔하지만 못지않게 잘 사용하는 법도 중요하다. 주위에 부족한 사람이 없는지 한번더 챙겨보라. 결국은 자신을 위해 사용하는 것이 될것이다.,정해진 것이 하나도 없다. 모두가 스스로 결정하고 정해야 하는 일들 뿐이다. 꼼수를 부리지 말고 서두를것 없이 신중하게 생각하고 순리에 맞게 진행하라.,나와 생각이 다름을 이해하고 너그러운 마음의 자세가 필요하다. 생각을 다르게 하면 별일 아닐 수 있으나 막상 받아들이기는 쉽지 않겠지만 대인 관계를 넗히는 하나의 방법이라 생각하자.,대화가 필요한 시기이다. 크다면 크고 작다면 작은 일이지만 여럿이 같이 하는 일이기에 혼자 고민한다고 해결되지는 않는다. 먼저 말을 건네 해결 방법을 찾아라. 금방 해결 할 수 있다.,사소한 시비거리가 생길 수 있다. 그동안 쌓였던 감정들을 정리할 수 있는 기회가 된다. 묵힌다고 다 좋은건 아니니 이번 기회에 털어버리고 좋은 관계를 만들가. 전화위복이 된 결과다.,혼자만의 생각을 고집하게 된다면 독단과 독선에 빠질수 있으니 주위의 의견을 귀담아 들어 자신의 것으로 만들어야 한다. 보다 많은 대화를 나눌 수 있는 시간을 할애하라.
118,중요하지 않은 일에 노력을 허비하지 말라. 하고자 하는 일과 해야 하는 일 사이에서 다소 혼선과 갈등이 생길 수 있으니 신중히 판단하고 행동하라.,한발 물러서 상황을 바라보는 마음의 여유가 필요하다. 조급하게 서두르지 않고 신중함을 가진다면 안 될것 또한 없다. 한박짜 쉬어간다고 생각하라.,특별히 좋을 것도 그렇다고 나쁠 것도 없다. 별다른 어려움 없이 진행 할 수 있으니 땀 흘린 만큼의 성과는 기대해도 좋다. 성실한 노력만이 필요할 뿐이다.,자신의 능력을 믿고 강하게 추진하던 일들이 막힘이 있다. 주위에 도움을 줄 많은 지인분들이 있으니 주저하지 말고 부탁하라. 흔쾌히 승락하여 어려움을 해결해 줄 것이다.,주위에서 나를 찾는 시기이다. 무엇을 부탁받는 자리가 아니라면 조금 귀찮다 느끼더라도 즐겁게 맞이 해는 것이 좋다. 원만한 대인관계가 많은 일들을 해결하는 지름길 임을 잊지 말라.,야망이 클 수록 위험도 커진다. 감당 할 수 없는 일을 벌이기 보다는 자신이 할 수 있는 만큼만 일을 벌이고 처리하는 것이 가장 현명한 태도이다.,"나서지 말고 침착하게 자신의 역할 자신의 몫을 챙기는 것이 좋다. 업무에 관련된 사항은 빨리 처리하는 게 좋으며, 당신의 탁월한 재능으로 남들이 어렵다고 한 일도 쉽게 처리할 수 있을 것이다.","일의 진행이 빨라지는 시기이니, 자신이 가지고 있는 능력을 십분 발휘하면 원하는 걸 얻을 수 있다. 다른 사람들과 충돌하기 보다 화해의 길을 모색하는 게 유리하며, 새롭게 시작하는 일에 앞서 기존의 일들은 마무리를 해야한다.",장기적인 안목으로 차분히 준비하라. 지금 당장 눈 앞에 보이는 것이 전부는 아니다. 큰 그림을 그려 큰 것을 얻으려 생각하고 고민할 때이다.,주위의 여건들이 많이 좋아 졌다는 것을 느낄수 있다. 이런 상황이라면 좋은 결과를 기대해봐도 좋은 것이다. 긍정적인 생각으로 착실히 진행하기 바란다.,중요하지 않은 일에 노력을 허비하지 말라. 하고자 하는 일과 해야 하는 일 사이에서 다소 혼선과 갈등이 생길 수 있으니 신중히 판단하고 행동하라.,한번만 쉬어 가는 시간을 갖자. 조급하지만 않는다면 생각보다 일이 잘 진행될 것이다. 긁어 부스럼 만들지 말고 천천히 내실을 쌓아가며 진행하기 바란다.
